{"txId":"0x3333333333333333333333333333333333333333333333333333333333333333","rawStatus":"UNDETERMINED","rawResult":"NO_MAJORITY","protocolDecisionOutcome":"undetermined","decidedAtBlock":null,"appealDeadline":null,"derived":{"displayLabel":"Undetermined (protocol-level, awaiting resolution)","isFinal":false}}
